{
  "run_id": "normal",
  "plan_date": "2026-09-25",
  "phase": "R",
  "planner": "cvx",
  "intervals": [
    {
      "ts_end": "2026-09-25T00:15:00Z",
      "setpoint_kw": 0.0,
      "mode": "normal"
    },
    {
      "ts_end": "2026-09-25T00:30:00Z",
      "setpoint_kw": 0.0,
      "mode": "normal"
    },
    {
      "ts_end": "2026-09-25T00:45:00Z",
      "setpoint_kw": 0.0,
      "mode": "normal"
    },
    {
      "ts_end": "2026-09-25T01:00:00Z",
      "setpoint_kw": 0.0,
      "mode": "normal"
    },
    {
      "ts_end": "2026-09-25T01:15:00Z",
      "setpoint_kw": 0.0,
      "mode": "normal"
    },
    {
      "ts_end": "2026-09-25T01:30:00Z",
      "setpoint_kw": 0.0,
      "mode": "normal"
    },
    {
      "ts_end": "2026-09-25T01:45:00Z",
      "setpoint_kw": 0.0,
      "mode": "normal"
    },
    {
      "ts_end": "2026-09-25T02:00:00Z",
      "setpoint_kw": 0.0,
      "mode": "normal"
    },
    {
      "ts_end": "2026-09-25T02:15:00Z",
      "setpoint_kw": 0.0,
      "mode": "normal"
    },
    {
      "ts_end": "2026-09-25T02:30:00Z",
      "setpoint_kw": 0.0,
      "mode": "normal"
    },
    {
      "ts_end": "2026-09-25T02:45:00Z",
      "setpoint_kw": 0.0,
      "mode": "normal"
    },
    {
      "ts_end": "2026-09-25T03:00:00Z",
      "setpoint_kw": 0.0,
      "mode": "normal"
    },
    {
      "ts_end": "2026-09-25T03:15:00Z",
      "setpoint_kw": 0.0,
      "mode": "normal"
    },
    {
      "ts_end": "2026-09-25T03:30:00Z",
      "setpoint_kw": 0.0,
      "mode": "normal"
    },
    {
      "ts_end": "2026-09-25T03:45:00Z",
      "setpoint_kw": 0.0,
      "mode": "normal"
    },
    {
      "ts_end": "2026-09-25T04:00:00Z",
      "setpoint_kw": 0.0,
      "mode": "normal"
    },
    {
      "ts_end": "2026-09-25T04:15:00Z",
      "setpoint_kw": 0.0,
      "mode": "normal"
    },
    {
      "ts_end": "2026-09-25T04:30:00Z",
      "setpoint_kw": 0.0,
      "mode": "normal"
    },
    {
      "ts_end": "2026-09-25T04:45:00Z",
      "setpoint_kw": 0.0,
      "mode": "normal"
    },
    {
      "ts_end": "2026-09-25T05:00:00Z",
      "setpoint_kw": 0.0,
      "mode": "normal"
    },
    {
      "ts_end": "2026-09-25T05:15:00Z",
      "setpoint_kw": 0.0,
      "mode": "normal"
    },
    {
      "ts_end": "2026-09-25T05:30:00Z",
      "setpoint_kw": 0.0,
      "mode": "normal"
    },
    {
      "ts_end": "2026-09-25T05:45:00Z",
      "setpoint_kw": 0.0,
      "mode": "normal"
    },
    {
      "ts_end": "2026-09-25T06:00:00Z",
      "setpoint_kw": 0.0,
      "mode": "normal"
    },
    {
      "ts_end": "2026-09-25T06:15:00Z",
      "setpoint_kw": 0.0,
      "mode": "normal"
    },
    {
      "ts_end": "2026-09-25T06:30:00Z",
      "setpoint_kw": 0.0,
      "mode": "normal"
    },
    {
      "ts_end": "2026-09-25T06:45:00Z",
      "setpoint_kw": 0.0,
      "mode": "normal"
    },
    {
      "ts_end": "2026-09-25T07:00:00Z",
      "setpoint_kw": 0.0,
      "mode": "normal"
    },
    {
      "ts_end": "2026-09-25T07:15:00Z",
      "setpoint_kw": 0.0,
      "mode": "normal"
    },
    {
      "ts_end": "2026-09-25T07:30:00Z",
      "setpoint_kw": 0.0,
      "mode": "normal"
    },
    {
      "ts_end": "2026-09-25T07:45:00Z",
      "setpoint_kw": 0.0,
      "mode": "normal"
    },
    {
      "ts_end": "2026-09-25T08:00:00Z",
      "setpoint_kw": 0.0,
      "mode": "normal"
    },
    {
      "ts_end": "2026-09-25T08:15:00Z",
      "setpoint_kw": 0.0,
      "mode": "normal"
    },
    {
      "ts_end": "2026-09-25T08:30:00Z",
      "setpoint_kw": 0.0,
      "mode": "normal"
    },
    {
      "ts_end": "2026-09-25T08:45:00Z",
      "setpoint_kw": 0.0,
      "mode": "normal"
    },
    {
      "ts_end": "2026-09-25T09:00:00Z",
      "setpoint_kw": 0.0,
      "mode": "normal"
    },
    {
      "ts_end": "2026-09-25T09:15:00Z",
      "setpoint_kw": 0.0,
      "mode": "normal"
    },
    {
      "ts_end": "2026-09-25T09:30:00Z",
      "setpoint_kw": 0.0,
      "mode": "normal"
    },
    {
      "ts_end": "2026-09-25T09:45:00Z",
      "setpoint_kw": 0.0,
      "mode": "normal"
    },
    {
      "ts_end": "2026-09-25T10:00:00Z",
      "setpoint_kw": -4.2,
      "mode": "normal"
    },
    {
      "ts_end": "2026-09-25T10:15:00Z",
      "setpoint_kw": -4.2,
      "mode": "normal"
    },
    {
      "ts_end": "2026-09-25T10:30:00Z",
      "setpoint_kw": -4.2,
      "mode": "normal"
    },
    {
      "ts_end": "2026-09-25T10:45:00Z",
      "setpoint_kw": -4.2,
      "mode": "normal"
    },
    {
      "ts_end": "2026-09-25T11:00:00Z",
      "setpoint_kw": -4.2,
      "mode": "normal"
    },
    {
      "ts_end": "2026-09-25T11:15:00Z",
      "setpoint_kw": -4.2,
      "mode": "normal"
    },
    {
      "ts_end": "2026-09-25T11:30:00Z",
      "setpoint_kw": -4.2,
      "mode": "normal"
    },
    {
      "ts_end": "2026-09-25T11:45:00Z",
      "setpoint_kw": -4.2,
      "mode": "normal"
    },
    {
      "ts_end": "2026-09-25T12:00:00Z",
      "setpoint_kw": -4.2,
      "mode": "normal"
    },
    {
      "ts_end": "2026-09-25T12:15:00Z",
      "setpoint_kw": -4.2,
      "mode": "normal"
    },
    {
      "ts_end": "2026-09-25T12:30:00Z",
      "setpoint_kw": -4.2,
      "mode": "normal"
    },
    {
      "ts_end": "2026-09-25T12:45:00Z",
      "setpoint_kw": -4.2,
      "mode": "normal"
    },
    {
      "ts_end": "2026-09-25T13:00:00Z",
      "setpoint_kw": -4.2,
      "mode": "normal"
    },
    {
      "ts_end": "2026-09-25T13:15:00Z",
      "setpoint_kw": -4.2,
      "mode": "normal"
    },
    {
      "ts_end": "2026-09-25T13:30:00Z",
      "setpoint_kw": -4.2,
      "mode": "normal"
    },
    {
      "ts_end": "2026-09-25T13:45:00Z",
      "setpoint_kw": -4.2,
      "mode": "normal"
    },
    {
      "ts_end": "2026-09-25T14:00:00Z",
      "setpoint_kw": 0.0,
      "mode": "normal"
    },
    {
      "ts_end": "2026-09-25T14:15:00Z",
      "setpoint_kw": 0.0,
      "mode": "normal"
    },
    {
      "ts_end": "2026-09-25T14:30:00Z",
      "setpoint_kw": 0.0,
      "mode": "normal"
    },
    {
      "ts_end": "2026-09-25T14:45:00Z",
      "setpoint_kw": 0.0,
      "mode": "normal"
    },
    {
      "ts_end": "2026-09-25T15:00:00Z",
      "setpoint_kw": 0.0,
      "mode": "normal"
    },
    {
      "ts_end": "2026-09-25T15:15:00Z",
      "setpoint_kw": 0.0,
      "mode": "normal"
    },
    {
      "ts_end": "2026-09-25T15:30:00Z",
      "setpoint_kw": 0.0,
      "mode": "normal"
    },
    {
      "ts_end": "2026-09-25T15:45:00Z",
      "setpoint_kw": 0.0,
      "mode": "normal"
    },
    {
      "ts_end": "2026-09-25T16:00:00Z",
      "setpoint_kw": 0.0,
      "mode": "normal"
    },
    {
      "ts_end": "2026-09-25T16:15:00Z",
      "setpoint_kw": 0.0,
      "mode": "normal"
    },
    {
      "ts_end": "2026-09-25T16:30:00Z",
      "setpoint_kw": 0.0,
      "mode": "normal"
    },
    {
      "ts_end": "2026-09-25T16:45:00Z",
      "setpoint_kw": 0.0,
      "mode": "normal"
    },
    {
      "ts_end": "2026-09-25T17:00:00Z",
      "setpoint_kw": 0.0,
      "mode": "normal"
    },
    {
      "ts_end": "2026-09-25T17:15:00Z",
      "setpoint_kw": 0.0,
      "mode": "normal"
    },
    {
      "ts_end": "2026-09-25T17:30:00Z",
      "setpoint_kw": 0.0,
      "mode": "normal"
    },
    {
      "ts_end": "2026-09-25T17:45:00Z",
      "setpoint_kw": 0.0,
      "mode": "normal"
    },
    {
      "ts_end": "2026-09-25T18:00:00Z",
      "setpoint_kw": 3.5,
      "mode": "normal"
    },
    {
      "ts_end": "2026-09-25T18:15:00Z",
      "setpoint_kw": 3.5,
      "mode": "normal"
    },
    {
      "ts_end": "2026-09-25T18:30:00Z",
      "setpoint_kw": 3.5,
      "mode": "normal"
    },
    {
      "ts_end": "2026-09-25T18:45:00Z",
      "setpoint_kw": 3.5,
      "mode": "normal"
    },
    {
      "ts_end": "2026-09-25T19:00:00Z",
      "setpoint_kw": 3.5,
      "mode": "normal"
    },
    {
      "ts_end": "2026-09-25T19:15:00Z",
      "setpoint_kw": 3.5,
      "mode": "normal"
    },
    {
      "ts_end": "2026-09-25T19:30:00Z",
      "setpoint_kw": 3.5,
      "mode": "normal"
    },
    {
      "ts_end": "2026-09-25T19:45:00Z",
      "setpoint_kw": 3.5,
      "mode": "normal"
    },
    {
      "ts_end": "2026-09-25T20:00:00Z",
      "setpoint_kw": 3.5,
      "mode": "normal"
    },
    {
      "ts_end": "2026-09-25T20:15:00Z",
      "setpoint_kw": 3.5,
      "mode": "normal"
    },
    {
      "ts_end": "2026-09-25T20:30:00Z",
      "setpoint_kw": 3.5,
      "mode": "normal"
    },
    {
      "ts_end": "2026-09-25T20:45:00Z",
      "setpoint_kw": 3.5,
      "mode": "normal"
    },
    {
      "ts_end": "2026-09-25T21:00:00Z",
      "setpoint_kw": 0.0,
      "mode": "normal"
    },
    {
      "ts_end": "2026-09-25T21:15:00Z",
      "setpoint_kw": 0.0,
      "mode": "normal"
    },
    {
      "ts_end": "2026-09-25T21:30:00Z",
      "setpoint_kw": 0.0,
      "mode": "normal"
    },
    {
      "ts_end": "2026-09-25T21:45:00Z",
      "setpoint_kw": 0.0,
      "mode": "normal"
    },
    {
      "ts_end": "2026-09-25T22:00:00Z",
      "setpoint_kw": 0.0,
      "mode": "normal"
    },
    {
      "ts_end": "2026-09-25T22:15:00Z",
      "setpoint_kw": 0.0,
      "mode": "normal"
    },
    {
      "ts_end": "2026-09-25T22:30:00Z",
      "setpoint_kw": 0.0,
      "mode": "normal"
    },
    {
      "ts_end": "2026-09-25T22:45:00Z",
      "setpoint_kw": 0.0,
      "mode": "normal"
    },
    {
      "ts_end": "2026-09-25T23:00:00Z",
      "setpoint_kw": 0.0,
      "mode": "normal"
    },
    {
      "ts_end": "2026-09-25T23:15:00Z",
      "setpoint_kw": 0.0,
      "mode": "normal"
    },
    {
      "ts_end": "2026-09-25T23:30:00Z",
      "setpoint_kw": 0.0,
      "mode": "normal"
    },
    {
      "ts_end": "2026-09-25T23:45:00Z",
      "setpoint_kw": 0.0,
      "mode": "normal"
    },
    {
      "ts_end": "2026-09-26T00:00:00Z",
      "setpoint_kw": 0.0,
      "mode": "normal"
    }
  ],
  "reserve_floor_kwh": 6.0,
  "expected_dr_kw": {
    "19:00-21:00": 8.0
  },